{
  "$schema": "https://json-schema.org/draft/2020-12/schema",
  "$id": "https://role-model.dev/schemas/taxonomy/group.schema.json",
  "title": "Taxonomy Group",
  "type": "object",
  "additionalProperties": false,
  "required": [
    "id",
    "kind",
    "label",
    "description",
    "primaryRoleIds",
    "secondaryRoleIds",
    "authority",
    "stability",
    "ui"
  ],
  "properties": {
    "id": {
      "type": "string",
      "minLength": 1
    },
    "kind": {
      "const": "group"
    },
    "label": {
      "type": "string",
      "minLength": 1
    },
    "description": {
      "type": "string",
      "minLength": 1
    },
    "authority": {
      "type": "object",
      "additionalProperties": false,
      "required": ["scope", "owner"],
      "properties": {
        "scope": {
          "enum": ["core", "provider", "client", "org", "team", "user"]
        },
        "owner": {
          "type": "string",
          "minLength": 1
        }
      }
    },
    "stability": {
      "enum": ["stable", "experimental", "deprecated"]
    },
    "replacement": {
      "type": "string",
      "description": "When stability is deprecated, the ID of the replacement entry."
    },
    "deprecationReason": {
      "type": "string",
      "description": "Human-readable reason for deprecation."
    },
    "primaryRoleIds": {
      "type": "array",
      "items": {
        "type": "string"
      }
    },
    "secondaryRoleIds": {
      "type": "array",
      "items": {
        "type": "string"
      }
    },
    "ui": {
      "type": "object",
      "additionalProperties": false,
      "required": ["sortOrder"],
      "properties": {
        "sortOrder": { "type": "integer" },
        "recommendedIcon": { "type": "string" },
        "recommendedAccent": { "type": "string" }
      }
    }
  }
}
